<?xml version="1.0" encoding="UTF-8"?>
<!-- edited with XMLSPY v5 rel. 4 U (http://www.xmlspy.com) by Asuka (Asuka) -->
<xs:schema xmlns:xs="http://www.w3.org/2001/XMLSchema" elementFormDefault="qualified" attributeFormDefault="unqualified">
	<xs:element name="design">
		<xs:annotation>
			<xs:documentation>Comment describing your root element</xs:documentation>
		</xs:annotation>
		<xs:complexType>
			<xs:sequence>
				<xs:element name="file" minOccurs="0" maxOccurs="unbounded">
					<xs:complexType>
						<xs:attribute name="name" type="xs:string" use="required"/>
						<xs:attribute name="description" type="xs:string" use="optional"/>
						<xs:attribute name="package" type="xs:string" use="optional"/>
						<xs:attribute name="jsFileName" type="xs:string" use="optional"/>
					</xs:complexType>
				</xs:element>
			</xs:sequence>
		</xs:complexType>
	</xs:element>
</xs:schema>
