<?xml version="1.0" encoding="UTF-8"?>
<design xmlns:xsi="http://www.w3.org/2001/XMLSchema-instance" xsi:noNamespaceSchemaLocation="crm.xsd">
    <!-- custint -->
    <file name="comm.xsd" description="" package="com.ffcs.crmd.cas.bean.crmbean.comm"/>
    <file name="checkphotonotredeal/checkPhotoNotReDeal.xsd" description=""
          package="com.ffcs.crmd.cas.bean.crmbean.checkphotonotredeal"/>
    <file name="checkrelintfdeporder/checkRelIntfDepOrder.xsd" description=""
          package="com.ffcs.crmd.cas.bean.crmbean.checkrelintfdeporder"/>
    <file name="removecustordermap/removeCustorderMap.xsd" description=""
          package="com.ffcs.crmd.cas.bean.crmbean.removecustordermap"/>
    <file name="querycustorder/queryCustOrder.xsd" description=""
          package="com.ffcs.crmd.cas.bean.crmbean.querycustorder"/>
    <file name="autorelcustorder/autoRelCustOrder.xsd" description=""
          package="com.ffcs.crmd.cas.bean.crmbean.autorelcustorder"/>
    <file name="checkcancel/checkCancel.xsd" description="" package="com.ffcs.crmd.cas.bean.crmbean.checkcancel"/>
    <file name="converttomodorder/convertToModOrder.xsd" description=""
          package="com.ffcs.crmd.cas.bean.crmbean.converttomodorder"/>
    <file name="continueacceptconfirm/continueAcceptConfirm.xsd" description=""
          package="com.ffcs.crmd.cas.bean.crmbean.continueacceptconfirm"/>
    <file name="noticetodealorder/noticeToDealOrder.xsd" description=""
          package="com.ffcs.crmd.cas.bean.crmbean.noticetodealorder"/>
    <file name="noticetodealorder/noticeToDealOrder.xsd" description=""
          package="com.ffcs.crmd.cas.bean.crmbean.noticetodealorder"/>
    <file name="queryParty/queryParty.xsd" description=""
          package="com.ffcs.crmd.cas.bean.crmbean.queryParty"/>
    <file name="createconnect/createConnect.xsd" description=""
          package="com.ffcs.crmd.cas.bean.crmbean.createconnect"/>
    <file name="saveDocInfo/saveDocInfo.xsd" description=""
          package="com.ffcs.crmd.cas.bean.crmbean.saveDocInfo"/>
    <file name="querycustorder/queryCustOrderByNum.xsd" description=""
          package="com.ffcs.crmd.cas.bean.crmbean.querycustorderbynum"/>
</design>
